{
  "upload_key": "00000000-0000-4000-8000-000000000803",
  "project_id": "00000000-0000-4000-8000-000000000020",
  "state": "PUBLISHED",
  "created_at": "2026-09-10T12:00:00Z",
  "document": {
    "document_id": "00000000-0000-4000-8000-000000000801",
    "project_id": "00000000-0000-4000-8000-000000000020",
    "folder": "specs",
    "name": "overview.md",
    "size": 2048,
    "mime": "text/markdown",
    "checksum": "sha256:aaaaaaaaaaaaaaaaaaaaaaaaaaaaaaaaaaaaaaaaaaaaaaaaaaaaaaaaaaaaaaaa",
    "uploaded_by": "00000000-0000-4000-8000-000000000030",
    "created_at": "2026-09-10T12:00:01Z"
  }
}
